source_review_id,slug,name,nose,palate,finish,conclusion_marcel,conclusion_sascha,source_url,source_api_endpoint,source_confidence,extraction_method
413,kilchoman-batch-strength-2024,Kilchoman Batch Strength (2024),"From the very first nosing, the aroma of cold ashes rises to the nose, as if the campfire had just stopped smouldering. There is also a subtle hint of iodine, reminiscent of a fresh sea breeze. The fruity accents of green apple and lemon balm, which blend gently into the smoke, are surprising. A subtle vanilla note rounds off the flavour and gives it a slight, subliminal sweetness.","The whisky is oily and warming on the tongue. The ash dominance from the nose continues, paired with a dry, chalky note. This is joined by a hint of unripe peach, which adds a subtle freshness, while a fine saltiness is reminiscent of sea spray. The flavours are powerful, direct and uncompromising - typically Islay.","Kilchoman remains true to itself in the finish: voluminous smoke dominates, accompanied by a light oak note that gives the whisky some depth. A mineral component reminiscent of pebbles resonates and reinforces the earthy character. The intensity lasts a long time without changing significantly.","This Kilchoman Batch Strength 2024 delivers exactly what you expect from a robust Islay: pure smoke, a generous helping of drinking pleasure, and a straightforward, honest statement. While it lacks the exciting depth to become an absolute favorite, it’s definitely a solid companion for fans of rustic peat drams on a campfire evening.","The Kilchoman Batch Strength 2024 impresses with its powerful structure and precise balance between smoky, maritime, and fruity notes, yet its flavor profile remains comparatively linear. If you’re looking for a technically well-balanced Islay whisky with a high proof, this is a solid example, though it leaves some room for more complexity and cask nuances.",/whisky-reviews/kilchoman-batch-strength-2024,/api/whisky-reviews/kilchoman-batch-strength-2024,high,api_json
327,compassbox-ultramarine,Compass Box Ultramarine,"A complex aroma unfolds from the very first nosing: a light, ashy peat smoke rises, accompanied by a fresh citrus note reminiscent of lemon and tart grapefruit. But it doesn't stop at fruit and smoke - a hint of leather and herbs combine with hints of cereals and grassy notes that are almost reminiscent of a dense coniferous forest. A flash of sour apple and unripe plum resonate before creamy caramel and fine herbs round off the aroma.","The complexity continues on the palate. The whisky is oily and intense, with a full, almost creamy mouthfeel. Dried fruit dominates the opening before apple and pear come through. Roasted almonds provide a subtle nuttiness, while menthol provides a cool contrast. And then it's there again - the cold smoke, which is reminiscent of an extinguished ember and perfectly rounds off the symphony of flavours.","The finish is nothing less than spectacular. The blend remains present, with a voluminous depth that is reflected in red fruit flavours, sweet lemon and fine smoke. The wood is perfectly integrated, never over-present, but delicate and elegant.",Ultramarine is like an exciting film for the senses – full of surprises that delight and leave you wanting more. The balance between smoky spice and fruity sweetness invites relaxed enjoyment without ever becoming dull. A blend that scores with character and charm – definitely a highlight for lovers with an adventurous spirit.,"Compass Box Ultramarine impresses with its precise structure and balanced complexity, harmoniously combining smoke, sherry, and citrus notes. The perfect integration of the 30-years sherry butts and Caol Ila component creates a profound, multi-layered blend with a long-lasting finish. A technically impressive example of modern blending artistry with clear balance and subtle cask maturation.",/whisky-reviews/compassbox-ultramarine,/api/whisky-reviews/compassbox-ultramarine,high,api_json
330,compassbox-metropolis,Compass Box Metropolis,"At first sniff, you feel like you're in a market with the scent of apricots, butterscotch and freshly roasted coffee. A light sea breeze blows past. And then there's that hint of honey that caresses the nose. Coconut? Could also be coconut, perhaps an exotic stall at the market. In any case: a fragrance that arouses curiosity.","The first sip is like jumping from one skyscraper roof to the next - exciting and sweet! Caramel sweets and creamy fudge coat the tongue, and then comes this light smoky note, reminiscent of a campfire evening in a city park. Copper leaf and a pinch of salt provide the necessary spice, while figs and sultanas give a hint of the Orient. A firework of flavours!","The finish is long. Dried fruit and a hint of old oak accompany us on the way home, and there is a delicate hint of milk chocolate at the end.","This Compass Box Metropolis brings true city life to the glass – lively, multifaceted, and with a smoky spice that makes you eager for the next sip. It’s not the gentlest dram, but that’s exactly what makes it an exciting companion for those who love whisky with character. An urban delight that takes the palate on a little adventure.","The Metropolis displays a balanced complexity, where the harmonious interplay of sherry cask maturation and subtle smokiness is particularly convincing. The structured balance between sweetness, spice, and dried fruits delivers a long, layered finish, which, through precise cask selection, underlines its urban identity. A well-crafted blend with a clear architectural line.",/whisky-reviews/compassbox-metropolis,/api/whisky-reviews/compassbox-metropolis,high,api_json
437,cameronbridge-1984-2019-34-years-van-wees,Cameronbridge 34 Years (1984/2019) - van Wees,"The aroma is a conversation starter. At first, it evokes a gas station – a hint of industrial notes that catch you off guard. Beneath this layer lies a fruity core: overripe cherries, coconut, and a touch of exotic mango, nectarine, and peach. Cashew nuts and a sense of decayed wood add earthy undertones, lending complexity to the bouquet.","On the palate, this whisky is powerful and multifaceted. The 54.90% ABV makes its presence known without overwhelming. Spicy oak takes the lead, supported by deep dark red fruits in the background. Then it takes an unexpected turn: an extreme dryness reminiscent of chalk dominates the mouthfeel, while an outstandingly oily texture makes the whisky almost viscous. A hint of soapiness may polarize, but it adds an intriguing layer to the complexity.","The finish surprises with its discrepancy. While the flavors linger on the tongue, the throat remains almost untouched. Subtle notes of honey, hay, and vanilla provide a gentle softness, although the overall impression feels almost ethereal.","A whisky that divides opinion and is great fun – with its unusual blend of industrial notes and exotic fruits, the Cameronbridge 1984 clearly stands out from the crowd. Its distinctive dryness and almost ethereal finish aren’t to everyone’s taste, but they make the character all the more intriguing. For anyone looking for a true whisky adventurer, this dram is a genuine hidden gem.","The Cameronbridge 1984/2019 displays remarkable structural complexity, well supported by its powerful 54.9% ABV. Despite the intense aromas and layered texture, the finish is surprisingly lean, which somewhat limits the balance. Overall, it’s a demanding grain whisky that reveals its strengths primarily through aromatic diversity and its unusual dryness.",/whisky-reviews/cameronbridge-1984-2019-34-years-van-wees,/api/whisky-reviews/cameronbridge-1984-2019-34-years-van-wees,high,api_json
345,ncnean-quiet-rebels-gordon,Nc'Nean Quiet Rebels Gordon (2009/2023),"The complexity of this whisky becomes apparent from the very first nosing. A seductive blend of coconut and vanilla meets fruity notes of plums, apricots and strawberries. These are joined by unripe pears and apples, which bring a slight acidity and lend freshness to the bouquet. Marzipan shimmers through in the background and provides a fine sweetness, while a subtle dryness rounds off the complex impression.","The first sip confirms the impression from the nose - the ‘Gordon’ is an intense, yet smooth whisky. An oily texture carries the vinous notes, which are characterised by peaches, blackberries and strawberries. Despite its strength, it remains mild and balanced. The fruity sweetness harmonises wonderfully with the spicy undertones of the casks and gives the whisky a pleasant depth. The combination of sherry and sweet wine casks creates an exciting balance between fruitiness and flavour.","The finish is strong and present without being too dominant. The oak provides structure and length, while the fine berry notes continue to be noticeable. The whisky finishes subtly and delicately without losing any of its intensity.","Nc'Nean succeeds with the Gordon in crafting a fruity and spicy whisky that’s a lot of fun and sits wonderfully in the glass thanks to its oily texture. A charming everyday companion for connoisseurs who aren’t afraid of experiments and enjoy exploring new flavor worlds – here, sustainability meets drinking pleasure.","The Gordon showcases a well-balanced cask composition that harmoniously blends fruitiness and spice without letting either dominate. Despite the intense aromas, the structure remains coherent and the finish balanced, making it ideal for fans of complex yet approachable Highland whiskies.",/whisky-reviews/ncnean-quiet-rebels-gordon,/api/whisky-reviews/ncnean-quiet-rebels-gordon,high,api_json
415,bowmore-2013-2024-10-years-douglas-laing,Bowmore 10 Years (2013/2024) - Douglas Laing,"The first impression is unconventional: there is a hint of musty shoebox and sweaty feet - unusual, but not unpleasant. After a few moments, the bouquet opens up: damp moss, a fresh sea breeze and delicate chalk notes are reminiscent of a stormy coast. The vanilla in the background provides a gentle rounding off and combines the rough Islay terrain with a subtle sweetness.","On the tongue, the Bowmore shows its full strength. A strong ash note dominates at first, before an almost sugary sweetness asserts itself - surprising and fascinating at the same time. Fresh vanilla and pear play with the oily mouthfeel and contribute to the pleasant balance. The smoke always remains present, but without masking the other flavours.","Long, voluminous and warming. The oak note typical of many Islay whiskies is held back here, instead the impression of light-coloured fruit and sugar remains. Despite its strength, the finish is comparatively fresh and light.","A smoky adventure with plenty of punch and a sweet playfulness – you can practically feel the stormy Islay coast. This isn’t a mainstream whisky, but a characterful dram full of edges and quirks that excites and leaves you wanting more.","Technically well-balanced between powerful smoke and surprising sweetness, the Bowmore 2013/2024 offers a structured complexity with a full-bodied finish. A successful example of an intense yet harmonious Islay whisky with a clearly defined profile.",/whisky-reviews/bowmore-2013-2024-10-years-douglas-laing,/api/whisky-reviews/bowmore-2013-2024-10-years-douglas-laing,high,api_json
424,glenfarclas-2012-2024-the-trinity-vintage-series,Glenfarclas (2012/2024) The Trinity Vintage Series,"Vanilla custard, apple and a pinch of dried apricot join the crumble cake as if they were having a party in a malty orchard. There's also a hint of hay - yes, hay! Not exactly what you'd expect in a whisky, but hey, who needs conventions? This aroma is so inviting that you almost forget to drink the whisky.","The first sip is like a sugary-sweet kiss from the orchard. Apricot and hay dance on the tongue, while the soft oak snuggles up to your taste buds like a good friend. The texture is creamy and oily, as if the whisky had decided to bathe itself in rape honey. It's sweet, but not overpowering - like a compliment from someone who really means what they say.","The finish is medium to long and leaves you with a smile. The oak makes its presence felt once again, accompanied by a light spiciness and a hint of fruitiness. The honey remains until the end.","This Glenfarclas is like a sunny afternoon on a Scottish meadow – sweet, charming, and with just enough oak character to keep things interesting. A whisky that’s fun and tells stories without trying too hard. For anyone looking for enjoyment with a wink, this one’s a bullseye.","The Glenfarclas 2012/2024 impresses with a well-balanced blend of sweet fruit notes and spicy oak that gives the whisky structure and depth. The complexity remains well-controlled without feeling overloaded, making it a solid representative of Speyside. A technically clean, balanced dram with a pleasant texture and a medium-length finish.",/whisky-reviews/glenfarclas-2012-2024-the-trinity-vintage-series,/api/whisky-reviews/glenfarclas-2012-2024-the-trinity-vintage-series,high,api_json
442,blended-scotch-whisky-release-2024-40-years-living-souls,Blended Scotch Whisky 40 Years (2024) - Living Souls,"The exciting complexity of this whisky is revealed from the very first nosing. Exotic fruits such as papaya, apricot and orange rise to the nose, accompanied by a subtle maritime breeze. Cool smoke is subtly noticeable - not intrusive, but harmoniously embedded. A fine citrus note, perhaps lemon, brings additional freshness. There are also hints of heather and a subtle spiciness. The aroma is not overly intense, but extremely inviting and complex.","On the palate, the whisky unfolds in all its splendour: oily, voluminous and wonderfully balanced. The tropical notes continue - pineapple and mandarin provide a juicy fruitiness, while a subtle spice of white pepper adds excitement. The smoke remains present but restrained - cold and finely interwoven with a nutty note of roasted almonds. A hint of BBQ sauce adds a slightly sweet and savoury nuance that rounds off the overall impression perfectly.","The finish is medium to long, with a great balance of wood, earth and freshness. The oak is present but not dominant, rather it provides a pleasant structure. An unexpected but extremely exciting effect is the minty-fresh smoky note that is noticeable in the aftertaste. There are also fine pine needles and a slight saltiness, which give the whisky an interesting maritime depth.","A 40-years whisky that surprises not only with its freshness but also delights with lively fruitiness and a hint of smoke – drinking this is simply a pleasure! Living Souls has managed to combine elegance and character without falling into boring oak clichés. For anyone seeking a multi-layered yet never dull dram, this blend is a real winner.","The Living Souls 40 Years impresses with its balanced harmony between fruity freshness, subtle smoke, and a well-integrated wood note that neither dominates nor gets lost. The complex structure, featuring mineral and maritime nuances, gives the blend remarkable depth and makes it a technically accomplished example of a matured blended Scotch. A whisky that captivates both nose and palate with its precision and harmony.",/whisky-reviews/blended-scotch-whisky-release-2024-40-years-living-souls,/api/whisky-reviews/blended-scotch-whisky-release-2024-40-years-living-souls,high,api_json
444,islay-blended-malt-scotch-whisky-kildalton-release-2024-19-years-living-souls,Islay Blended Malt Scotch Whisky Kildalton 19 Years (2024) - Living Souls,"As soon as you raise the glass, you know: There's a fire here. Wisps of bacon smoke, barbecue charcoal, liquorice and espresso fill the nose. These are joined by pulled pork, honey and a hint of coniferous wood. An intense, yet harmonious flavour.","The palate continues just as powerfully: warm embers, earthy tones, honey-bacon and dark cherries. The combination of sweet smoke and red fruit is simply brilliant. This is joined by salty olives, a strong peaty note and a pleasant spiciness that rounds off the flavour. The 42% alcohol is well integrated and ensures a full-bodied, warm mouthfeel.","The finish is long and voluminous, but still pleasantly soft. Sweet oak, liquorice and a hint of tobacco linger as the smoke slowly evaporates. Not a brutal finish, but one with style - smoky, sweet and with just the right amount of spice.","This Kildalton 2024 brings together the smoky Islay power with a surprisingly sweet, almost gentle side – a true pleasure that leaves you wanting more. For fans of character and drinkability, it’s a bullseye, delivering aromas of honey, bacon, and dark fruit that simply make it fun to enjoy.","The Kildalton Release 2024 impresses with its balanced interplay between intense peat smoke and sweet, fruity nuances, all wrapped in a complex, harmonious structure. The 19 years of maturation give it a pleasant depth and a long-lasting, elegant finish that is technically perfectly tuned.",/whisky-reviews/islay-blended-malt-scotch-whisky-kildalton-release-2024-19-years-living-souls,/api/whisky-reviews/islay-blended-malt-scotch-whisky-kildalton-release-2024-19-years-living-souls,high,api_json
445,ledaig-2024-18-years-living-souls,Ledaig and Tobermory 18 Years (2024) - Living Souls,"The first impression: earthy, cold smoke, as if a burnt-out campfire had been left on a damp meadow. This is joined by spicy heather and old forest honey, which gives the fragrance a pleasant depth. There are subtle flashes of vanilla and a hint of ripe apple in the background. Interestingly, there is even a subtle hint of camembert - an unusual but exciting detail.","The attack is creamy and gentle, almost surprisingly soft. Maritime notes resonate, accompanied by lemongrass and a subtle freshness. The smoke is present, but rather restrained - not the rough peaty club, but a subtle, ashy veil. A slight rubbery note comes through, reminiscent of young Islay whiskies, but it remains in the background. Some tequila-like spice and sea salt round off the experience.",The finish is of medium length and again shows the typical ashy notes of a mature Ledaig. There are also gentle oak tones and a subtle aftertaste of apple and pear.,"This Ledaig & Tobermory 2024 is like a peaceful walk by the sea – smoky, but never overpowering. Those expecting wild peat monsters will instead discover a charming, restrained character that delights with its gentle spice and surprising details like Camembert, making it a joy to drink. A whisky that impresses with its elegant balance between power and subtlety.","The Living Souls Ledaig & Tobermory 2024 presents an interesting balance between earthy smoky and maritime notes, yet remains rather subtle and reserved in its structure. The composition feels well balanced but could benefit from more intensity and sharper edges to fully unleash the potential of this 18-years whisky. For lovers of balanced, complex blends, it offers a solid, technically well-crafted alternative.",/whisky-reviews/ledaig-2024-18-years-living-souls,/api/whisky-reviews/ledaig-2024-18-years-living-souls,high,api_json
443,blended-scotch-whisky-release-2024-15-years-living-souls,Blended Scotch Whisky 15 Years (2024) - Living Souls,"The very first aroma surprises with a fresh, lively note. Honey and a malty, almost cereal-like sweetness dominate, accompanied by a hint of red fruit and a delicate orange marmalade. Berries and red fruits lend the bouquet a fruity liveliness, while a light chocolate note and a hint of rye provide depth. Complex and inviting.","The whisky is creamy and spicy on the palate. Grapefruit and a delicate dark chocolate harmonise with a subtle date sweetness and a hint of black pepper. Red fruits and brown sugar provide a pleasant sweetness, while turmeric and a dry spiciness round off the flavour. A nice balance between sweet and strong.","The finish is tingling and lively, with a pleasant gingerbread spice and a slightly oaky note. Medium-long and sweet, it nevertheless remains balanced without being overpowering.","A whisky that’s a lot of fun, delighting with its spicy depth and sweet-fruity notes – perfect for enjoyable evenings and fans of complex yet approachable blends. The lively character and subtle sherry touch deliver drinking pleasure with plenty of punch. Add a scoop of hazelnut ice cream, and the evening is saved!","The 15-years blended Scotch from Living Souls strikes a successful balance between sweet fruit aromas and spicy notes, supported by a subtle sherry influence. Its structured aromatics and well-balanced, medium-length finish make it a solid example of complex blends with good drinking strength. Overall, a harmoniously composed whisky that showcases its strengths through a multifaceted flavor profile.",/whisky-reviews/blended-scotch-whisky-release-2024-15-years-living-souls,/api/whisky-reviews/blended-scotch-whisky-release-2024-15-years-living-souls,high,api_json
408,ruadh-maor-2011-2024-jack-the-ripper-malts-of-scotland,Ruadh Maor (2011/2024) Jack the Ripper - Malts of Scotland,"The Ruadh Maor reveals its complexity from the very first sniff. Dark fruits such as ripe plums and a hint of blackberries mingle with an intense smoke that is strongly reminiscent of Islay whiskies. The iodised, almost medicinal notes are also striking - an impression of plaster and camomile pervades the aroma. A green apple brings a subtle freshness, while warm, woody notes of sandalwood emphasise the depth.","The first sip is a powerful prelude: Spicy oak notes meet sweet liquorice and the dark fruits from the nose. The smoke remains present, accompanied by a maritime saltiness that reinforces the Islay feeling. A hint of forest honey provides an unexpected, pleasant sweetness and perfectly balances the spicy intensity.","In the finish, the whisky remains maritime and spicy, but without being too overpowering. The saltiness gives it a refreshing finish, while the smoke lingers for a short time. The finish is of medium length and leaves a balanced memory of wood, smoke and sea breeze.","A Highland whisky that really lifts the spirits with its smoky power play and sweet sherry note. Ruadh Maor 2011/2024 Jack the Ripper isn’t a cuddly dram, but a characterful one that delights with maritime freshness and robust smoke – perfect for anyone who likes to try something different while still focusing on enjoyment.","With its balanced interplay of intense smokiness, maritime saltiness, and complex fruit notes, the Ruadh Maor 2011/2024 Jack the Ripper impresses as a structured Highland whisky. The harmonious fusion of sweetness, spice, and oak delivers a precise, multi-layered tasting experience with a long-lasting elegant finish.",/whisky-reviews/ruadh-maor-2011-2024-jack-the-ripper-malts-of-scotland,/api/whisky-reviews/ruadh-maor-2011-2024-jack-the-ripper-malts-of-scotland,high,api_json
428,macallan-2003-2023-20-years-gordon-amp-macphail,Macallan 20 Years (2003/2023) Speymalt - Gordon & MacPhail,"This whisky doesn't mince its words from the very first nosing. What emerges from the glass is a true sherry grenade. A heavy, almost dramatic combination of wet carpet, leather and tobacco meets the autumnal freshness of damp leaves. This is joined by the sweet darkness of burnt caramel. It is a fragrance that tells stories - smoky, earthy and deeply rooted in decades of ageing.","The true magic of this whisky unfolds on the tongue. The first thing you notice is a distinctive dryness reminiscent of a fine sherry. This is accompanied by an amazingly oily texture that takes over the entire mouth. The flavours are intense and clear: fig, rich and dark, is accompanied by earthy leather and bitter cocoa. There is no room for restraint here - this whisky has character and shows it.","The finish is the icing on the cake of this complex drop. It is long, as befits a whisky aged for 20 years, and has a lovely spiciness that finishes astringent and dry. But before it disappears, a slight fruity sweetness flashes through.","This Macallan 2003/2023 is a true taste experience – intense, with a powerful sherry explosion that makes every sip exciting. It demands your attention but rewards you with a complex blend of spice, sweetness, and character that’s simply enjoyable. For connoisseurs seeking a whisky with bite and soul, this is a real bullseye!","With its balanced structure of intense sherry notes, fine oak, and subtle fruity sweetness, the Macallan 2003/2023 showcases an impressive interplay of power and elegance. Despite the high 58.3% ABV, it is well integrated and offers a complex yet harmonious balance that guarantees both depth and a long-lasting finish.",/whisky-reviews/macallan-2003-2023-20-years-gordon-amp-macphail,/api/whisky-reviews/macallan-2003-2023-20-years-gordon-amp-macphail,high,api_json
