source_review_id,slug,name,nose,palate,finish,conclusion_marcel,conclusion_sascha,source_url,source_api_endpoint,source_confidence,extraction_method
155,glenallachie-8-years,GlenAllachie 8 Years,"The nose of the GlenAllachie 8 Years is a beautiful blend of spicy and sweet notes. Hints of cinnamon and gingerbread spices dance on the nose, while subtle nuances of burnt caramel and walnuts add a distinct depth. The sweet warmth of forest honey combines with the coniferous forest after rain.","The flavour of the single malt is just as exciting as its aroma. It is viscous and full-bodied on the tongue, with a buttery-soft texture on the palate. The flavours of caramel and cinnamon dominate, followed by a dash of sugar syrup that leaves a pleasant sweetness. An unexpected kick of eucalyptus adds a refreshing complexity.",The finish of the Scotch is of medium length and offers notes of oak and spice. A light floral note rounds off the overall picture.,"Here, the GlenAllachie 8 Years reveals its approachable yet characterful side – a whisky that’s genuinely enjoyable, delighting with its warm sweetness and a hint of eucalyptus. For anyone seeking uncomplicated pleasure with a touch of spice, this is a real winner, even if it doesn’t quite make it onto the podium.","The GlenAllachie 8 Years impresses with a solid balance between sweet sherry notes and spicy oak, though it falls a bit short in complexity. The texture is pleasantly full-bodied, and the finish is medium-length with floral accents – a well-structured Speyside malt that represents a reliable choice in its price range.",/whisky-reviews/glenallachie-8-years,/api/whisky-reviews/glenallachie-8-years,high,api_json
95,balmenach-8-years-barrique-cask-191-best-dram,Balmenach 8 Years (2013/2022) Barrique Finish - Best Dram,"The nose of the 8-years Balmenach single malt is intense and immediately present. A clear note of ripe cherry jam immediately hits the senses, accompanied by deep nuances of fermented plums. A touch of heavy red wine and a hint of cane sugar round off the bouquet, while deep red wine gums add a sweet and tantalising dimension.","The first sip reveals a powerfully sweet flavour characterised by ripe fruit and subtle vinous notes. Dark wine gums provide a complex sweetness, while a pleasant warmth envelops the palate. A surprising sulphur note, reminiscent of rotten egg, adds an unexpected nuance.","The finish is extremely spicy and long-lasting, with a lingering sweetness that gradually gives way to a drier character. Dark chocolate remains.","This Balmenach 8 Years reveals itself as a true character with its intense fruity sweetness and surprisingly dry finish, leaving you wanting more. The sulfur notes are divisive but also add intriguing edges and corners to the glass – not everyone’s cup of tea, but definitely an entertaining dram for adventurous connoisseurs.","The Balmenach 8 Years Best Dram impresses with its balanced structure between sweet fruit aromas and a spicy, dry finish. Despite the distracting sulfur note, the complexity remains intact, while the barrique finish gives the whisky an interesting depth that fans of complex Speyside whiskies will particularly appreciate.",/whisky-reviews/balmenach-8-years-barrique-cask-191-best-dram,/api/whisky-reviews/balmenach-8-years-barrique-cask-191-best-dram,high,api_json
176,cardhu-18-years,Cardhu 18 Years,"On the nose, the Speysider opens heavy but not intense. Distinct woody flavours cover the lighter notes of light fruits such as pears and the hint of honey with vanilla that resonates. Floral nuances and a hint of peach or apricot can be sensed.","The Cardhu 18 years is unfortunately a little weak on the chest. Soft and spicy dry, it has notes of oak, peach, avocado and honeydew melon. The Speysider is infused with a slight sweetness and some baking cocoa. The flavour profile is pleasantly mild, but the nose clearly promised us more here.",The finish is nicely tart and spicy.,"The Cardhu 18 Years has charm, but it comes across as somewhat reserved and tame – it lacks the promised depth one expects from such an aged malt. It’s fine for a relaxed evening, but not a dramatic experience. A pity, as it could have been infused with more passion.","The Cardhu 18 Years presents itself with a clean structure, yet the 40% ABV and chill filtration noticeably mute the aromatics. The balance between wood, fruit, and spice is there, but overall it remains too flat and insufficiently complex for an 18-years Speysider.",/whisky-reviews/cardhu-18-years,/api/whisky-reviews/cardhu-18-years,high,api_json
88,longrow-peated-2021,Longrow Peated (2021),"At first sniff, the nose is enveloped by a wealth of flavours. An earthy and peaty aroma wafts across, like a hint of a campfire on the beach. This is joined by mineral nuances that lend depth to the bouquet. Light phenolic notes dance with a hint of salt, accompanied by subtle hints of seaweed and kelp. A sweet note of vanilla sugar and a hint of pineapple provide a pleasant sweetness, while a light floral note resonates in the background.","The flavour of Longrow Peated reveals a harmonious combination of smoky and sweet notes. The strong peat smoke is present, but well balanced by a pleasant sweetness of sugar and honey. Surprising textures of chalk and aseptic paper add an interesting complexity to the flavour, while fruity elements of peach and salty hints of seaweed round off the profile.","The finish is long-lasting and impressive. A maritime saltiness lingers, paired with a hint of oak and an intense smoke that caresses the palate.","A smoky delight with enough character to instantly spark a craving for more – Longrow Peated is robust, honest, and simply a lot of fun. For a NAS whisky, it makes a real statement in Campbeltown with its salty-sweet balance.","Longrow Peated impresses with its balanced structure between peaty smoke and maritime notes, complemented by subtle sweetness and mineral depth. Despite its youth, it shows remarkable balance and complexity, making it a solid representative of the Campbeltown region.",/whisky-reviews/longrow-peated-2021,/api/whisky-reviews/longrow-peated-2021,high,api_json
125,horst-luening-batch-2-2021-10,Horst Lüning Blended Malt Batch 2 10 Years,"Already in the aroma, the blend presents itself as very fresh and fruity. We discover clear notes of citrus, vanilla, and sweet maltiness. Accompanied by a finely tuned spiciness. The sherry casks leave a light influence of raisins.","In the mouth, the malt remains true to its line. The sweetness of malt and the freshness of citrus fruits prevail. The slight spiciness and the subtle hints of sherry aromas hold back a bit but are recognizable. Overall, it provides a pleasantly creamy mouthfeel.",The finish of this whisky is medium-long and warming. It remains very mild and pleasant. A slight dryness spreads across the palate.,"A genuine pleasure to drink, hitting the mark perfectly with its gentle sweetness and fresh citrus notes. Horst Lüning demonstrates here that an honest blended malt without any frills can be a real joy – ideal for connoisseurs seeking an uncomplicated companion.","The Horst Lüning Blended Malt Batch 2 impresses with a well-balanced harmony between malt sweetness, citrus freshness, and a subtle sherry note that lends the 10-years blend a refined complexity. Despite its mild structure, it occasionally lacks a bit of depth but remains a solid and well-crafted release in this price range.",/whisky-reviews/horst-luening-batch-2-2021-10,/api/whisky-reviews/horst-luening-batch-2-2021-10,high,api_json
179,the-westfalian-2013-2021-cask-57,The Westfalian TW57,"A hint of BBQ and the scent of a charred barbecue grill awaken our senses and remind us of summer barbecues. Earthy nuances lend the bouquet a down-to-earth depth, while the gentle hint of an outgoing fireplace adds a nostalgic note. Sweet hints of ripe plums and the tantalising aroma of dates wrapped in bacon round off the olfactory experience.","The first sip reveals a creamy texture that caresses the palate. Cold smoke and ash meet meaty notes reminiscent of a savoury BBQ sauce. The deep, dark chocolate combines harmoniously with a hint of burnt caramel, while the ultra-earthy notes lend an unmistakable depth. Surprising nuances of smoked ham, burnt fairground mushrooms and the aroma of leather and rosemary contribute to a fascinating flavour experience.","The finish is long and astringent, with a subtle tart note of Amarena cherries unfolding. Black pepper and a subtle oak presence round off the finish, which ends with a pleasant dryness and a hint of spice.","With its smoky BBQ charm and sweet-savory notes, The Westfalian TW57 is an experience that’s both fun and surprising. It challenges the drinker without ever becoming dull – a true character from Paderborn that leaves you wanting more.","The Westfalian TW57 impresses with its balanced structure and the complex interplay of smoky, sweet, and earthy aromas. The precise balance between intense flavor nuances and the long, spicy finish makes it a technically accomplished single cask whisky with great depth.",/whisky-reviews/the-westfalian-2013-2021-cask-57,/api/whisky-reviews/the-westfalian-2013-2021-cask-57,high,api_json
182,ruadh-maor-12-dram-mor,Ruadh Maor 12 Years - Dràm Mòr,"The aroma reminds us of a burning, rusty fire barrel. We perceive the smoke of smoldering fire without finding earthier notes of peat or tar. The smoke has a hint of iodine, but by no means as plaster-like as one would expect from Islay malts. After a few minutes in the glass, the First Fill Bourbon cask can unfold its effect. We detect sweet vanilla and a hint of honey.","Upon first sip, we immediately taste the sweetness of glazed honey bacon. An almost barbecue-like combination of sweet vanilla and meaty smoke unfolds on the palate. The notion of iodine, present in the aroma, has completely disappeared. The mouthfeel is very pleasant. The malt has high viscosity, is slightly dry, and has a tingling dusty quality.","The finish is simple and rather short for a smoky whisky. The delicate smoky profile lingers somewhat. Otherwise, we perceive fine oak notes and some sweet-spicy grill aromas.","This Ruadh Maor delivers exactly what it promises: a smoky campfire experience with a wonderfully sweet bacon note. It’s not the most complex malt, but that’s precisely what makes it so charming and easy to drink – perfect for relaxed evenings by the fire.","A clearly defined smoke profile meets a balanced sweetness here, convincingly reflecting the cask character of the First Fill Bourbon Hogsheads. Despite its straightforward aroma, the malt remains intriguing thanks to its pleasant viscosity and finely tuned finish.",/whisky-reviews/ruadh-maor-12-dram-mor,/api/whisky-reviews/ruadh-maor-12-dram-mor,high,api_json
270,i-am-root-too-spirits-alchemist,"I Am Root, Too! - The Spirits Alchemist","The nose is greeted by a rich aroma of vanilla and malt, infused with sweet notes of sugar, perhaps even sugar cane. Earthy nuances are present, accompanied by a hint of smoke, which is really minimal. A slight presence of quince and even a hint of what reminds you of socks after a football match round off the unusual flavour profile.","At the first sip, the question of a hint of smoke remains in the air. What is clear, however, is the intense earthiness that dominates the palate. It's almost as if you're biting straight into the grass, while sweet notes clearly recede into the background. Surprising elements such as peanut butter and eucalyptus mingle with the flavours of rock sugar and rooty vegetables.",The finish is of short to medium duration and brings out the earth and a loamy note. A hint of vanilla and a slight influence of oak round off the finish.,"A whisky that definitely divides opinion with its unusual finish in a sugar beet cask – it surprises with earthy notes and a hint of football sock aroma, something you don't come across every day. For connoisseurs who enjoy venturing off the beaten path, ""I Am Root, Too!"" is an intriguing companion full of character and potential surprises.","This 5-years single malt impresses with its complex balance between sweet vanilla and malt notes and a dominant earthy structure, which gains an unusual spiciness from the sugar beet finish. Despite its high strength, it feels well integrated, although the short finish with its clayey accents won’t be to everyone’s taste.",/whisky-reviews/i-am-root-too-spirits-alchemist,/api/whisky-reviews/i-am-root-too-spirits-alchemist,high,api_json
278,penderyn-myth,Penderyn Myth,"Notes of chewing gum, grape and sugar dance harmoniously together, followed by a hint of molasses and light hay. A light floral note hovers over everything, while a gentle creamy note and light stone fruits round off the olfactory experience.","The first sip reveals a remarkable combination of grassy and hay-like flavours accompanied by floral notes. The texture is creamy and creamy, with a hint of sweetness and a delicate pear flavour that caresses the palate.","The finish of the Penderyn Myth is short and surprisingly characterised by an enormous bitterness from the oak. A slight dryness remains on the palate, while the finish is perceived as somewhat unexciting overall.","Penderyn Myth is a smooth pleasure with a playful interplay of aromas that’s enjoyable, even though the finish, with its oak bitterness, slightly dampens the fun. For a relaxed dram in between, it’s definitely a good choice that shows character without becoming too complicated.","Penderyn Myth impresses with a balanced creaminess and floral nuances, but loses harmony due to a brief, very bitter finish. Overall, it’s a solid composition that would have benefited from a stronger balance between fruitiness and oak.",/whisky-reviews/penderyn-myth,/api/whisky-reviews/penderyn-myth,high,api_json
277,penderyn-legend,Penderyn Legend,"Nosing the Penderyn Legend reveals sweet honey, fresh green apples and a light pear sweetness. A malty vanilla note gently dominates, accompanied by a hint of Obstler (schnapps made from fruit, mostly produced in Germany). The freshness is remarkable, with a bright, spicy presence.","The flavour of the Singe Malt from Wales is initially sweet and malty, with a hint of brown sugar that lends a warm and inviting note. A creamy, almost waxy texture envelops the palate, while fruity flavours of mango and blackberries unfold. A slice of apple pie mingles with a subtle citrus freshness of lemon zest, giving the flavour a balanced complexity.","The finish is medium long and slightly spicy, with a subtle note of burnt oak. A drop of peach tea lends a soothing quality, while a youthful note flashes at the end.","Penderyn Legend brings fun to the glass with its sweet fruity notes and creamy texture, even though the Madeira finish could, in my opinion, show a bit more punch. A pleasant companion for relaxed evenings, it scores with its youthful freshness but doesn’t create any drama.","The combination of ex-Buffalo Trace and Madeira cask maturation provides a solid structure with balanced sweetness and a light spiciness, although the Madeira finish remains somewhat restrained. Overall, a well-balanced single malt that, however, lacks a deeper cask intensity to add more complexity.",/whisky-reviews/penderyn-legend,/api/whisky-reviews/penderyn-legend,high,api_json
279,penderyn-celt,Penderyn Celt,"Starting with the Ex-Laphroaig peated cask, we perceive light phenolic smoke, some fire smoke and an idea of salty coast. The ex-bourbon cask then delivers vanilla-sweet notes, neutral chewing gum flavour and some orange peel. A good match.","The Penderyn Celt plays out both flavours here. Medicinal, phenolic smoke flavours with a little iodine meet vanilla, cane sugar, slightly floral and hay-like notes. Somewhat tart grapefruit and green apple round off the flavour.",The medium-long to long Finish is characterised by cold smoke with a maritime touch.,"The Penderyn Celt is an uncomplicated malt that pleasantly surprises with its smoky and vanilla blend – ideal for anyone looking for an affordable entry into Welsh whisky. While it lacks the depth of an older malt, it’s precisely this fresh youthfulness that makes it charming and easy to drink.","With a balanced interplay between phenolic smoke and sweet bourbon notes, the Penderyn Celt impresses through clear cask integration and a clean, maritime-influenced finish. Despite its rather simple aromatic profile, it shows a solid structure, though it falls short of expectations in intensity and complexity.",/whisky-reviews/penderyn-celt,/api/whisky-reviews/penderyn-celt,high,api_json
257,owensboro-anam-na-h-alba,Owensboro - Anam na h-Alba,"The nose is immediately hit with the full flavor payload of a cask-strength bourbon. The scent is intensely nutty and oaky, showcasing the impressive work done by the fresh cask. Notes of burnt caramel and a subtle leather undertone emerge. After letting the whiskey rest for a bit, fruity notes reveal themselves—thinking of exotic fruits like pineapple or passion fruit.","The young bourbon starts of intense on the palate. Sweet caramel, pronounced oak, and a wonderfully oily viscosity present themselves. Add to that a slight tingling of white pepper – all without the 59.9% feeling overpowering. While we initially thought of peanuts on the nose, the taste leans towards a spicier profile reminiscent of nutmeg. Tropical fruit flavors reappear, accompanied by a faint hint of solvent, likely owing to its youth.","In the medium-length finish, no big surprises await. The intense oaky and nutty characteristics linger, leaving behind a delightful aroma. A subtle caramel sweetness complements the rather heavy, spicy notes.","A bourbon that’s fun with its raw power and intense aromatics – perfect for those who like it rough and honest. The nutty-caramel notes bring drinking pleasure, even if the edges and corners sometimes feel a bit coarse. Not a collector’s item, but a solid enjoyment for an easygoing evening.","Technically clean and presenting a convincing balance between sweetness, spice, and oak, this cask-strength bourbon from Owensboro shows a robust structure. However, it lacks the fine complexity that would round out its character a bit more. Overall, a well-made, if somewhat undifferentiated, single barrel bourbon.",/whisky-reviews/owensboro-anam-na-h-alba,/api/whisky-reviews/owensboro-anam-na-h-alba,high,api_json
128,balcones-texas-rye,Balcones Texas Rye,"Rye opens properly, with lots of chocolate. There is also some salted caramel, malted grain and a tiny hint of smoke on the nose. The chocolate rye is particularly interesting here and makes the whisky seem like a rye beer.","Chilli chocolate - intensely flavoured and yet light. The Balcones Texas Rye Whisky whets the appetite for more with aromas of rye spice, German grey bread and something malt-like with oak spice and even more dark chocolate. Beautifully balanced, even if still a little youthful in places.",Chocolate and some leather remain in the medium-long finish.,"The Balcones Texas Rye brings plenty of fun with its chocolaty rye spice and breathes fresh life into the glass. Sure, its youth is still evident, but that’s exactly what gives it a lively, almost cheeky personality – definitely a rye that’s enjoyable and piques your curiosity for more.","A well-structured rye with a balanced interplay between chocolaty notes and a spicy rye profile, though clearly marked by its youth. The blend of different rye varieties creates interesting aromas, but it’s still uncertain whether longer maturation might smooth out some of the edges.",/whisky-reviews/balcones-texas-rye,/api/whisky-reviews/balcones-texas-rye,high,api_json
282,torabhaig-allt-gleann-the-legacy-series,Torabhaig Allt Gleann The Legacy Series,"On the nose, it becomes clear what it's all about: the smoke profile takes center stage. Refined sugar and vanilla from the bourbon casks form the foundation. Barbecue bacon is ever-present. The smoke presents itself mineral-maritime, almost asphalt-like. We think of a rocky pebble beach.","On the palate, the peat fire is also in the foreground. A smoldering campfire surrounded by sugary sweetness and a hint of malt. Here, the maritime flavors of seaweed and sea salt become slightly more prominent. There's also a certain vegetable-like quality that we would describe as white beans and parsnips.","On the finish, Torabhaig is long, dry, and powerfully salty. The central theme of smoke, ash, coast, and sea continues. In the finish, there's a hint of oak - like a barrel of pickles.","Torabhaig Allt Gleann captivates with its smoky character and maritime notes that are genuinely enjoyable. Despite its youth, the whisky feels surprisingly rounded and invites relaxed evenings by the fireplace. A promising representative from the Isle of Skye that leaves you wanting more!","With a clearly defined smoke profile and a well-balanced coastal maturation, Torabhaig Allt Gleann demonstrates an impressive harmony between mineral freshness and sweet bourbon notes. The structure feels mature and harmonious despite the lack of an age statement, with maritime saltiness shaping the finish. A technically convincing single malt with great potential for development.",/whisky-reviews/torabhaig-allt-gleann-the-legacy-series,/api/whisky-reviews/torabhaig-allt-gleann-the-legacy-series,high,api_json
123,begemann-whisky-eichenschild,Begemann Whisky Eichenschild 5 Years,"The Begemann opens with damp grass and unpleasant petrol. Unfortunately, the smell of new wellies with metallic notes doesn't make the whole thing any better.","The single malt whisky can best be described as watery with a little sugar, vomit and ethanol. With some sandpit sand.","There is virtually no finish, apart from a slight afterburn.","Someone clearly tried to rush things – this whisky feels like it’s been parked in a metal tank for five years, lacking any real joy or character. There’s a bit of consolation in the hyper-local approach, but flavor-wise it’s rather disappointing.","The structure of the Begemann Eichenschild comes across as unbalanced and watery, accompanied by unpleasant metallic and chemical notes. Despite its regional ambitions, this 5-years malt lacks maturity and harmonious complexity.",/whisky-reviews/begemann-whisky-eichenschild,/api/whisky-reviews/begemann-whisky-eichenschild,high,api_json
86,loch-lomond-18-years,Loch Lomond 18 Years,"On the nose, this single malt presents an intriguing combination of roasted aromas and exotic fruitiness. We detect caramel and toasted pine nuts, accompanied by hints of grapefruit and a grainy banana bread. The fruity sweetness is enveloped in a light but cool smoke, reminiscent of egg carton (which may sound negative, but is not meant as such).","On the palate, Loch Lomond 18 begins with a fruity sweetness. The mouthfeel is soft and oily, spreading astringently and presenting a full-bodied berry note with hints of plums and oranges. Additionally, there are exotic citrus-like flavors. After a short while, the aroma shifts to herbal mint notes and surprisingly clear phenolic almost rubber-like smoke.","The finish is medium-length and warming, leaving an enduring impression of spicy oak and a hint of white pepper, without being sharp. Tobacco and tea leaves round off the experience.","Loch Lomond 18 is a pleasant companion for relaxed evenings, offering fun with its fruity and spicy character. Despite the harmonious aromas, I miss a little spark of surprise that would elevate this malt to a true highlight. It's a pity that E150 slightly clouds the natural character – that really wasn’t necessary.","The Loch Lomond 18 impresses with a solid balance of fruity and smoky notes that create a complex structure. The medium-length maturation reveals itself elegantly, although the caramel color loses some authenticity due to the use of caramel coloring. Overall, a well-crafted single malt with minor compromises in purity.",/whisky-reviews/loch-lomond-18-years,/api/whisky-reviews/loch-lomond-18-years,high,api_json
82,springbank-15,Springbank 15 Years,"Upon nosing, robust fruity notes greet us immediately. We encounter a generous portion of sherry accompanied by dark chocolate, roasted dates, and a hint of caramel. In the background, there's a subtle citrus note. The velvety aroma is rounded off by light smoke and some maritime notes.","On the palate, this Springbank is also very robust. Strong spice and pleasant oak underpin a bouquet of nuts and dried fruits. Allowing it some time in the mouth reveals leathery flavors, raisins, figs, and a touch of earthiness.","The Single Malt continues its expected trajectory in the finish as well. Robust, powerful, spicy, and very long. We discover great malty sweetness and the lingering aromas of oak, leather, and sherry.","The Springbank 15 captivates with its multi-layered character and creamy indulgence – a true Campbeltown treasure that’s a joy to drink. Despite the hefty price tag, you can definitely treat yourself to the dramatic pleasure of this artisanal malt, even if the hype seems a bit overblown.","An impressively balanced composition of sherry, oak, and spicy notes that gives the 15-years Springbank a strong structural backbone. The complex harmony justifies the craftsmanship, though price and availability remain points to scrutinize critically.",/whisky-reviews/springbank-15,/api/whisky-reviews/springbank-15,high,api_json
